{
 "$schema": "https://json-schema.org/draft/2020-12/schema",
 "$id": "urn:tribe:hosted:meta:v1",
 "title": "Tribe hosted page: meta",
 "description": "Freshness for the shell: one as-of and one sentence per layer (never joined into one line), plus how many reels, creators, patterns, drafts and TRIBE reads are in the store.",
 "x-kind": "meta",
 "x-key": "^index$",
 "type": "object",
 "additionalProperties": false,
 "required": [
  "v",
  "rendered_at",
  "layers",
  "n",
  "patterns_built_at"
 ],
 "properties": {
  "v": {
   "type": "integer",
   "const": 1
  },
  "rendered_at": {
   "$ref": "#/$defs/datetime"
  },
  "layers": {
   "type": "object",
   "additionalProperties": false,
   "required": [
    "counts",
    "facts",
    "shape",
    "brain"
   ],
   "properties": {
    "counts": {
     "type": "object",
     "additionalProperties": false,
     "required": [
      "as_of",
      "text"
     ],
     "properties": {
      "as_of": {
       "$ref": "#/$defs/date_or_null"
      },
      "text": {
       "$ref": "#/$defs/text",
       "x-layer": "counts",
       "maxLength": 160
      }
     }
    },
    "facts": {
     "type": "object",
     "additionalProperties": false,
     "required": [
      "as_of",
      "text"
     ],
     "properties": {
      "as_of": {
       "$ref": "#/$defs/datetime_or_null"
      },
      "text": {
       "$ref": "#/$defs/text",
       "x-layer": "facts",
       "maxLength": 160
      }
     }
    },
    "shape": {
     "type": "object",
     "additionalProperties": false,
     "required": [
      "as_of",
      "text"
     ],
     "properties": {
      "as_of": {
       "$ref": "#/$defs/datetime_or_null"
      },
      "text": {
       "$ref": "#/$defs/text",
       "x-layer": "shape",
       "maxLength": 160
      }
     }
    },
    "brain": {
     "type": "object",
     "additionalProperties": false,
     "required": [
      "as_of",
      "text"
     ],
     "properties": {
      "as_of": {
       "$ref": "#/$defs/date_or_null"
      },
      "text": {
       "$ref": "#/$defs/text",
       "x-layer": "brain",
       "maxLength": 160
      }
     }
    }
   }
  },
  "n": {
   "type": "object",
   "additionalProperties": false,
   "required": [
    "reels",
    "creators",
    "patterns",
    "drafts",
    "tribe_reads"
   ],
   "properties": {
    "reels": {
     "$ref": "#/$defs/count"
    },
    "creators": {
     "$ref": "#/$defs/count"
    },
    "patterns": {
     "$ref": "#/$defs/count"
    },
    "drafts": {
     "$ref": "#/$defs/count"
    },
    "tribe_reads": {
     "$ref": "#/$defs/count"
    }
   }
  },
  "patterns_built_at": {
   "$ref": "#/$defs/datetime_or_null"
  }
 },
 "$defs": {
  "text": {
   "type": "string",
   "minLength": 1,
   "maxLength": 600,
   "not": {
    "pattern": "\\\\|(^|[^A-Za-z])[A-Za-z]:/|/Users/|OneDrive|AppData|private/|\\.env\\b|\\.npy\\b|\\.jsonl?\\b|\\.txt\\b|\\.jpe?g\\b|\\.(mp4|mov|m4v|webm|mkv|avi|wav|m4a|mp3)\\b|said: [\\\"“]"
   },
   "description": "Display text: no laptop paths, file names, private folders or quoted speech."
  },
  "text_or_null": {
   "anyOf": [
    {
     "type": "null"
    },
    {
     "$ref": "#/$defs/text"
    }
   ]
  },
  "date": {
   "type": "string",
   "pattern": "^\\d{4}-\\d{2}-\\d{2}$"
  },
  "date_or_null": {
   "anyOf": [
    {
     "type": "null"
    },
    {
     "$ref": "#/$defs/date"
    }
   ]
  },
  "datetime": {
   "type": "string",
   "pattern": "^\\d{4}-\\d{2}-\\d{2}T\\d{2}:\\d{2}(:\\d{2}(\\.\\d+)?)?(Z|[+-]\\d{2}:\\d{2})$"
  },
  "datetime_or_null": {
   "anyOf": [
    {
     "type": "null"
    },
    {
     "$ref": "#/$defs/datetime"
    }
   ]
  },
  "shortcode": {
   "type": "string",
   "pattern": "^[A-Za-z0-9_-]{5,20}$"
  },
  "handle": {
   "type": "string",
   "pattern": "^[A-Za-z0-9._]{1,30}$"
  },
  "handle_at": {
   "type": "string",
   "pattern": "^@[A-Za-z0-9._]{1,30}$"
  },
  "ig_url": {
   "type": "string",
   "maxLength": 200,
   "pattern": "^https://www\\.instagram\\.com/([A-Za-z0-9._]{1,30}/)?(reel|reels|p)/[A-Za-z0-9_-]{5,40}/?$"
  },
  "chip": {
   "type": "string",
   "pattern": "^\\d{1,2}:[0-5]\\d(-\\d{1,2}:[0-5]\\d)?$"
  },
  "chip_or_null": {
   "anyOf": [
    {
     "type": "null"
    },
    {
     "$ref": "#/$defs/chip"
    }
   ]
  },
  "draft_id": {
   "type": "string",
   "pattern": "^\\d{8}-[A-Za-z0-9][A-Za-z0-9-]{1,60}$"
  },
  "pattern_id": {
   "type": "string",
   "pattern": "^(hook|structure|cta|format)\\.(caption|spoken)\\.[a-z0-9-]{1,80}$"
  },
  "job_id": {
   "type": "string",
   "pattern": "^\\d{8}-\\d{6}-[0-9a-f]{8}$"
  },
  "seconds": {
   "type": "number",
   "minimum": 0,
   "maximum": 3600
  },
  "count": {
   "type": "integer",
   "minimum": 0,
   "maximum": 100000
  },
  "line_key": {
   "type": "string",
   "enum": [
    "seeing",
    "hearing",
    "language",
    "attention"
   ]
  }
 }
}
